deal_title,investor_company,investor_role,investment_amount_usd
Milford Regional Medical Center — Buyout/LBO (2024-10),UMass Memorial Health Care,PARTICIPANT,
Inpatient Behavioral Healthcare Facility (Acadia Healthcare / Tufts Medicine) — Joint Venture (2022-06),"Acadia Healthcare Company, Tufts Medicine",PARTICIPANT,
Baystate Medical Center — Grant (2021-12),"The United States Department of Justice, U.S. Department of Health and Human Services",PARTICIPANT,
Caring Health Center — Grant (2021-12),U.S. Department of Health and Human Services,PARTICIPANT,
Dothouse Health — Grant (2021-12),U.S. Department of Health and Human Services,PARTICIPANT,
Lawrence F Quigley Memorial Hospital — Grant (2021-12),The US Department of Veterans Affairs,PARTICIPANT,
Outer Cape Health Services — Grant (2021-12),U.S. Department of Health and Human Services,PARTICIPANT,
Spaulding Rehabilitation Hospital (srh) Volunteer Services — Grant (2021-12),"U.S. Department of Education, U.S. Department of Health and Human Services, United States Department of War",PARTICIPANT,
Athol Hospital — Grant (2020-12),U.S. Department of Health and Human Services,PARTICIPANT,
Cape Cod Hospital — Grant (2020-12),U.S. Department of Health and Human Services,PARTICIPANT,
Franklin Baystate Medical Center — Grant (2020-12),U.S. Department of Health and Human Services,PARTICIPANT,
Jordan Health Systems — Grant (2020-12),U.S. Department of Health and Human Services,PARTICIPANT,
UMass Memorial Health Harrington — Merger/Acquisition (2020-09),Mass.Gov,PARTICIPANT,
Joint Venture (Baystate Health Foundation / Kindred Healthcare) — Joint Venture (2020-07),"Baystate Health Foundation, Kindred Healthcare",PARTICIPANT,
Emerson Hospital Center for Specialty Care — Corporate Asset Purchase (2020-02),"AEW Capital Management, Celera Properties",PARTICIPANT,
Beth Israel Deaconess Medical Center — Merger/Acquisition (2019-03),amfAR,PARTICIPANT,
Berkshire Medical Center — Grant (2018-12),U.S. Department of Education,PARTICIPANT,
Signature Healthcare Corporation — Grant (2018-12),U.S. Department of Health and Human Services,PARTICIPANT,
Fitchburg Redevelopment — Grant (2017-12),U.S. Environmental Protection Agency,PARTICIPANT,
New England Rehab Services of Central Massachusetts — Secondary Transaction - Private (2014-06),"Encompass Health, UMass Memorial Health Care",PARTICIPANT,
Dana-Farber Cancer Institute — Grant (2012-01),Massachusetts Life Sciences Center,PARTICIPANT,
Bevel — Early Stage VC (2025-10),"Abstract Ventures, General Catalyst, Script Capital (United States), South Park Commons",PARTICIPANT,
Marble Health — Early Stage VC (2025-10),"Costanoa Ventures, Daybreak Ventures, FJ Labs, IA Ventures, Khosla Ventures, Lorimer Ventures, Town Hall Ventures",PARTICIPANT,
Previvor Edge — Seed Round (2025-10),"CoFound Partners, Designer Fund, Humbition, Max Ventures, Red Swan Ventures",PARTICIPANT,
Somatix — Later Stage VC (2025-10),"Digitalis Ventures, Dreamit Ventures, East Post Road Ventures, Forefront Analytics, Innovation Authority, InsurTech Hub Munich, LG Nova, New York Digital Health Innovation Lab, Starbucks",PARTICIPANT,
The IMA Group — Debt - Acquisition (2025-10),"Centre Partners, Linden (Chicago)",PARTICIPANT,
Soufflé Therapeutics — Early Stage VC (2025-10),"AbbVie, Amgen, ARCH Venture Partners, Bessemer Venture Partners, Breyer Capital, Janus Henderson Investors, Leaps by Bayer, Novo Nordisk, Polaris Partners, Safar Partners, Temasek Holdings, The Invus Group, Vida Ventures (Los Angeles)",PARTICIPANT,
SQ Innovation — Later Stage VC (2025-10),Marco Poel,PARTICIPANT,
Goodpath — Later Stage VC (2025-10),"Blindspot Ventures, City Light Capital, Endeavor Greece, Global Founders Capital, Healthy Ventures, Indicator Ventures, MassMutual Ventures, Switch Ventures",PARTICIPANT,
OraLiva — Seed Round (2025-10),"CareQuest Innovation Partners, DCVC, Endless Frontier Labs, First Flight Venture Center, Matter (Consulting Services (B2B)), National Cancer Institute, National Institute of Dental and Craniofacial Research, NYU Entrepreneurial Institute, NYU Summer Launchpad, Preetpal Sidhu, RTP Angel Fund, U. S. National Science Foundation",PARTICIPANT,
Proteus Motion — Later Stage VC (2025-10),"412 Venture Fund, Acies, Acies Investments, Blake Griffin Enterprises, Brandon Shorenstein, Bryson DeChambeau, Chris Capuano, David Stern, David Winfield, Founders First, Geoffrey Bernstein, Harris Blitzer Sports & Entertainment, HBSE Ventures, Hichens, Harrison & Company, Hospital for Special Surgery Endowment, James Lester, John Kosner, Lauder Partners, Liebenthal Ventures, Makers Camp, Matthew Dellavedova, MIT Alumni Angels of New York, Monozukuri Ventures, Raga Partners (New York), Richard Boyce, Sammy Barcelona, SoundBoard Venture Fund",PARTICIPANT,
Beacon Biosignals — Later Stage VC (2025-10),"Andrew Hollenbeck, Casdin Capital, General Catalyst, Half Court Ventures, Iaso Ventures, Indicator Ventures, Logos Capital, Nexus NeuroTech Ventures, Synetro Group",PARTICIPANT,
Bolt.Healthcare — Later Stage VC (2025-10),MainSheet Ventures,PARTICIPANT,
Folia Health — Later Stage VC (2025-10),"AARP Innovation Labs, AgeTech Collaborative, Bantam Group, Character (VC), Correlation Ventures, Create Health Ventures, Crosslink Capital, Joyance Partners, Kaya Ventures, Launchpad Venture Group, MassChallenge, S3 Ventures, TBD Angels, Walnut Ventures",PARTICIPANT,
Grouper — Later Stage VC (2025-09),"Aging2.0, David Norris, JSL Health Capital, Lawrence Leisure, Louis Brandt, Magnify VC, New Enterprise Associates, Pixel Perfect Ventures, Shelby Bryan, Sorenson Impact Foundation",PARTICIPANT,
Neura Health — Later Stage VC (2025-09),"American Heart Association Ventures, Correlation Ventures, E12 Venture Capital, Esplanade Healthtech Ventures, Global Founders Capital, GoingVC Partners, Index Ventures, JCurve, Jeffrey Weiner, Koch Disruptive Technologies, Next Play Ventures, Nikhil Krishnan, Norwest, Pear (California), Plug and Play Tech Center, UCSF Rosenman Institute",PARTICIPANT,
Aloe Care Health — Secondary Transaction - Private (2025-09),"0924 Investments, AgeTech Capital, City Light Capital, Drumbeat Ventures, Gaingels, Grit Capital Partners, HEPCO Capital Management, Innovations for Impact, Laerdal Million Lives Fund, Oceans Ventures, Puget Sound Venture Club, RiverPark Ventures, Springbank Collective, Wasson Enterprise",PARTICIPANT,
Aware Recovery Care — PE Growth/Expansion (2025-09),"BPEA Private Equity, Connecticut Innovations, Health Enterprise Partners",PARTICIPANT,
Judi Health — Later Stage VC (2025-09),"9Yards Capital, Alumni Ventures, Atlantic Health System, B Capital Group, Banner Health, Edison Partners, Emerald Development Managers, F-Prime Capital, General Catalyst, Generation Investment Management, Goldman Sachs Asset Management, Hawaii Pacific Health, Inova Health System, Koru Capital (New York), Lehigh Valley Health Network, Memorial Hermann Foundation, Mubadala Capital, Nebraska Medicine, Novant Health, Ochsner Health, Prime Health, Prime Therapeutics, RioBlanco Capital, Transformation Capital, Wellington Management, WellSpan Health",PARTICIPANT,
Kyruus — Buyout/LBO (2025-09),"Adam Goulburn, Allumia Ventures, Bon Secours Mercy Health, Carl Byers, Dustin Moskovitz, Echo Health Ventures, Ed Park, Eight Roads, F-Prime Capital, Francisco Partners, GLG (New York), Highland Capital Partners, John Goldsmith, Jonathan Bush, Lux Capital, McKesson Ventures, New Leaf Venture, Salesforce Ventures, Swedish Health Services, Transformation Capital, UPMC Enterprises, Venrock",PARTICIPANT,
MoldCo — Seed Round (2025-09),"AJ2 Fund, Behind Genius Ventures, Bleu Capital, Boost VC, Cantos Ventures, Climate Capital, Collaborative Fund, Conscience, Harpoon VC, Moth Fund, Night Ventures, SoGal Ventures, Solari Capital, Starship Ventures, Sunflower Fund (Miami)",PARTICIPANT,
Annie Aesthetic — PE Growth/Expansion (2025-09),"Brookside Equity Partners, InterAlpen Partners, Plexus Capital",PARTICIPANT,
Conceivable Life Sciences — Early Stage VC (2025-09),"ACME Capital, Advance Venture Partners, ARTIS Ventures, Atlantic Health Venture Studio, Black Opal Ventures, Cadence Healthcare Ventures, Coriolis Ventures, Future Positive Capital, Muse Capital, Scrub Capital, Stride.VC, Time BioVentures",PARTICIPANT,
Doctronic — Early Stage VC (2025-09),"Davidovs Venture Collective, Fei-Fei Li, Hacker Fellowship Zero, Jay Desai, Lightspeed Venture Partners, Mantis VC, Scott Belsky, Seven Stars Ventures, Tusk Ventures, Union Square Ventures",PARTICIPANT,
Marvix AI — Seed Round (2025-09),"Leo Capital, SeedToB Capital",PARTICIPANT,
CBSET — Buyout/LBO (2025-09),Arlington Capital Partners,PARTICIPANT,
Mother of Fact — Seed Round (2025-09),"EcotoneGrowth Ventures, EforAll, gBETA, GrowthX Capital, Maine Venture Fund, Mass Digital Health, Roux Institute at Northeastern University, StartUp Health, Techstars, The Paragon Group, Village Capital",PARTICIPANT,
Diana Health — Later Stage VC (2025-09),".406 Ventures, AlleyCorp, HealthQuest Capital, LRVHealth, Norwest",PARTICIPANT,
Nurture Genomics — Early Stage VC (2025-09),"Bantam Group, CH Innovations, HealthTech Capital, Impact Assets",PARTICIPANT,
BranchLab — Early Stage VC (2025-09),"AJI Capital, Aperiam Ventures, Next Ventures (Texas), nvp capital, Service Provider Capital, Swift Ventures, Textbook Ventures",PARTICIPANT,
Sharp Performance — Seed Round (2025-09),"A*, Andreessen Horowitz, Commonweal Ventures, Formation (New York), Liquid 2 Ventures, Siesta Ventures, SV Angel",PARTICIPANT,
Joint Ai (Clinics/Outpatient Services) — Early Stage VC (2025-09),"Richard King Mellon Foundation, Supply Chain Ventures",PARTICIPANT,
Accendo — PE Growth/Expansion (2025-09),1585 Healthcare,PARTICIPANT,
Anjo.ai — Early Stage VC (2025-09),"AllerFund Ventures, The Consortium for Technology & Innovation in Pediatrics",PARTICIPANT,
FOLX Health — Later Stage VC (2025-09),"7wire Ventures, Bessemer Venture Partners, Define Ventures, Foresite Capital, Polaris Partners, Seae Ventures",PARTICIPANT,
Honeydew (Clinics/Outpatient Services) — Early Stage VC (2025-09),"Arch Grants, Browder Capital, Footwork",PARTICIPANT,
Jana — Early Stage VC (2025-09),GrowthX Capital,PARTICIPANT,
LightForce — Later Stage VC (2025-09),"Acceleration International, Ally Bridge Group, AM Ventures, American Association of Orthodontists, CareCapital, Delta Dental of California, Dental Innovation Alliance, Kleiner Perkins, MassChallenge, Matrix, Matter Venture Partners, Omega Venture Partners, Transformation Capital, Trinity Capital (Phoenix), Tyche Partners",PARTICIPANT,
Nix — Later Stage VC (2025-09),"Black Lab Sports, Business Development Bank of Canada, Capital Q Ventures, Great Oaks Venture Capital, Harvard Innovation Launch Lab, iSelect Fund, Jonathan Sheffi, LionTree Partners, MassChallenge, Oregon Sports Angels, Shorewind Capital, Stadia Ventures, Techstars, The MBA Fund, Tillman Venture Partners, White Road Investments",PARTICIPANT,
Perx Health — Later Stage VC (2025-09),"Airtree Ventures, ANDHealth, Artesian, Blackbird Ventures (US), Brandon Capital, Giant Leap, HCF Catalyst, Jobs for NSW, Matter (Consulting Services (B2B)), Plug and Play Tech Center, RHL Ventures, Slingshot Ventures, Startmate, Tenmile, Tractor Ventures, Wild Wood Ventures, YMF Investments",PARTICIPANT,
CareCentrix — Buyout/LBO (2025-08),Sycamore Partners,PARTICIPANT,
Medical Brain — Later Stage VC (2025-08),"Seed Healthcare, Thornapple River Capital",PARTICIPANT,
Arcadia Solutions — Buyout/LBO (2025-08),Nordic Capital,PARTICIPANT,
FallCall Solutions — Seed Round (2025-08),"AgeTech Collaborative, Connecticut Innovations, CTNext, Ratan Agarwal",PARTICIPANT,
Accident Care Alliance — Leveraged Recapitalization (2025-08),Garnett Station Partners,PARTICIPANT,
Cascala Health — Seed Round (2025-08),"Digital Health Venture Partners, Eniac Ventures, Flare Capital Partners, Omega Healthcare Investors, Redesign Health, Tau Ventures, Ziegler Healthcare Capital",PARTICIPANT,
Enzo Biochem — Buyout/LBO (2025-08),Battery Ventures,PARTICIPANT,
Somite — Early Stage VC (2025-08),"Ajinomoto, AMD Ventures, Astellas Venture Management, BC Growth Equity, Chan Zuckerberg Initiative, Conscience, Conviction Partners, DarkMode Ventures, Dhuna Ventures, Factorial Funds, Fidji Simo, Fusion Fund, Harpoon VC, Harvard Innovation Launch Lab, Kendra Harris, Khosla Ventures, Lerer Hippeau, Mark VC, Martin Chavez, Montage Ventures, Nachum Shamir, Next Coast Ventures, Paul Harris, Pitango Venture Capital, Samsung NEXT Ventures, SciFi VC, TechAviv Founder Partners, Texas Venture Partners, Trust Ventures",PARTICIPANT,
Wisdom — Early Stage VC (2025-08),"Aquiline (New York), Juxtapose, Permanent Capital (Investor), R2 Ventures",PARTICIPANT,
Outcome Referrals — Seed Round (2025-08),National Institutes of Health,PARTICIPANT,
Cartwheel (Healthcare Services) — Early Stage VC (2025-08),"Able Partners, Alumni Ventures, A-Street, BoxGroup, General Catalyst, Menlo Ventures, Oxeon Partners, Reach Capital, Venture Workshop, Workshop Ventures",PARTICIPANT,
Advanced TelePsych — Early Stage VC (2025-08),"Connecticut Innovations, Hesperia Capital",PARTICIPANT,
PigPug Health — Later Stage VC (2025-08),"MiLA Capital, Multiple Hub, NYC Startup Leadership Program, Rev: Ithaca Startup Works, Southwest National Pediatric Device Innovation Consortium, StartUp Health, TechMinsk",PARTICIPANT,
ReferWell — Later Stage VC (2025-08),"Blueprint Health, Connecticut Innovations, Health Catalyst Capital Management, Meyer Ventures Investments, New York Angels, Viewside Capital Partners, Zeal Tech",PARTICIPANT,
Isaac Health — Early Stage VC (2025-08),"AirAngels, Aurum Venture Partners, B Capital Group, Black Opal Ventures, CoFound Partners, Flare Capital Partners, Industry Ventures, Meridian Street Capital, Primetime Partners, UCSF Rosenman Institute, United Healthcare Accelerator, VU Venture Partners",PARTICIPANT,
Peerbridge Health — Later Stage VC (2025-08),"Ascent Biomedical Ventures, HealthTech Arkansas, HealthX Ventures, HeartX Accelerator, Kinled Holding, MedTech Innovator, Mendota Venture Capital",PARTICIPANT,
Aidin — Later Stage VC (2025-08),"Activate Venture Partners, Andrew Dunn, Bilal Zuberi, Blueprint Health, Cedars-Sinai Accelerator, Charles Songhurst, David Eisenberg, FCA Venture Partners, General Catalyst, Healthcare Angels, HLM Investment Partners, New York Digital Health Innovation Lab, Oakwood Circle Ventures, Red Swan Ventures, Rohit Keswani, Romulus Capital, Techstars, Vin Fabiani, XLerateHealth",PARTICIPANT,
Circadian OS — Seed Round (2025-08),"IndieBio, SOSV",PARTICIPANT,
Elder Care Homecare — PE Growth/Expansion (2025-08),"Rallyday Partners, Stellus Capital Management",PARTICIPANT,
Thirty Madison — Merger/Acquisition (2025-08),"137 Ventures, Alpha Partners, Alumni Ventures, Atacama Ventures, Benjamin Cogan, Bracket Capital, Calm Ventures, Catapult VC, Comcast Ventures, Concept to Co, CVS Health Ventures, Divya Gugnani, Elkstone, Entrepreneurs Roundtable Accelerator, ERA (Automation/Workflow Software), Evolution VC Partners, First Round Capital, Four Cities Capital, Gaingels, Greycroft, Hayley Barna, HealthQuest Capital, HillCour Capital, Imaginary Ventures, Johnson and Johnson JJDC, Maveron, Mousse Partners, Niche Capital (San Francisco), Nordstar Partners, Northzone Ventures, Polaris Partners, Remarkable Ventures, Rosecliff Venture Partners, Sand Hill Angels, STEADFAST Capital Ventures, Tournon Ventures, Two River Ventures, Union Square Ventures, Ventioneers, Wittington Ventures",PARTICIPANT,
Kestrel Therapeutics — Later Stage VC (2025-08),"Cormorant Asset Management, Harvard Innovation Launch Lab, Pfizer Ventures, S32, Santé Ventures",PARTICIPANT,
Method AI — Early Stage VC (2025-08),"Cleveland Clinic, JobsOhio Growth Capital",PARTICIPANT,
Summus — Later Stage VC (2025-08),"ArgyleRoad, Danaher, Glenstone Foundation, Outsiders Fund, Sator Grove Holdings, Savoy Capital (Texas), Teamworthy Group",PARTICIPANT,
Laptis — Early Stage VC (2025-08),"Harvard HealthLab Accelerators, Lightbank (Venture Capital), MIT Solve, O'Leary Ventures",PARTICIPANT,
Quartet Health — PE Growth/Expansion (2025-08),California Health Care Foundation,PARTICIPANT,
A Place for Mom — Debt - General (2025-07),"General Atlantic, Insight Partners (New York), Silver Lake",PARTICIPANT,
Journey Meditation — Later Stage VC (2025-07),"37 Angels, Akatsuki Entertainment Technology Fund, Alumni Ventures, Band of Angels, Basecamp Fund, BDMI, Betaworks, Brooklyn Bridge Ventures, Cambrian Growth Partners, Canaan Partners, City Light Capital, Courtside Ventures, Erik de Stefanis, Everywhere Ventures, Gaingels, HealthTech Capital, ID8 Investments, J4.Ventures, J-Impact, Joyance Partners, J-Ventures, Life Science Angels, ManchesterStory, Matthew Caspari, Miami Angels, Nelstone Ventures, New York Angels, New York Venture Partners, North 50 Venture Capital, StartUp Health, Stephen Hays, Stormbreaker Ventures, Symbiotic Ventures, Verve Capital",PARTICIPANT,
Prognos Health — Debt - General (2025-07),"ARC Angel Fund, Bodhi Capital, Cigna Ventures, GIS Strategic Ventures, Guardian Life Insurance Company of America, Hermed Capital, Hikma Ventures, Labcorp Venture Fund, Marshall Wace, Maywic Select Investments, Montage Capital, MSD Global Health Innovation Fund, Red & Blue Ventures, Safeguard Scientifics, StartUp Health",PARTICIPANT,
Beam Health — Later Stage VC (2025-07),"AltaIR Capital, Chaos Ventures (New York), Comcast NBCUniversal LIFT Labs, Focal (VC), FoundersBoost, Green Egg Ventures, Joyance Partners, MATH Venture Partners, StartUp Health, TechNexus Venture Collaborative, Techstars",PARTICIPANT,
Aidoc — Later Stage VC (2025-07),"Alpha Intelligence Capital, Amazon Web Services, CDIB Capital International, Deep Learning, Emerge Ventures (Tel Aviv), General Catalyst, Google for Startups, Hartford HealthCare, Jibe Ventures, Magma Venture Partners, Maor Investments, Mercy, Microsoft for Startups, NVentures (Santa Clara), RISE (Accelerator), Shahar Tzafrir, Square Peg Capital, Sutter Health, Synetro Group, TCV, TLV Partners, WellSpan Health",PARTICIPANT,
Fortuna Health — Early Stage VC (2025-07),"Andreessen Horowitz, BoxGroup, Cyrus Massoumi, Ellen DaSilva, Elliott Cohen, Gershon Capital, Iyah Romm, Jeff Gerard, John Legend, Sequoia Capital, Sylvia Romm, Y Combinator",PARTICIPANT,
OpenEvidence — Later Stage VC (2025-07),"Brian Sheth, Coatue Management, Conviction Partners, Greycroft, GV, Jim Breyer, Kenneth Moelis, Kleiner Perkins, Sequoia Capital, Thrive Capital, Xfund, Ziff Davis",PARTICIPANT,
CoreMap — Later Stage VC (2025-07),"DRIVEN Accelerator Hub, Dudley Fund, Hula, MassMEDIC, Minnow Ventures, Northpoint Capital Group, P5 Health Ventures, Philips, Qure Ventures, Ronny Ginor, U. S. National Science Foundation, University Of Vermont Health Network",PARTICIPANT,
New England Fertility Institute — Merger/Acquisition (2025-07),"Corbel Capital Partners, Weave Growth Partners",PARTICIPANT,
The Difference Card — Buyout/LBO (2025-07),Stone Point Capital,PARTICIPANT,
Bloomer Tech — Grant (2025-06),"BCBS Health Equity Business Accelerator, Catalytic Impact Foundation, Draper University, Global MIT, Impact Assets, John Abele, Koa Labs, Massachusetts Institute of Technology, MassChallenge, MassVentures, Material Impact (Boston), MIT Delta V, MIT Sandbox, National Heart, Lung, and Blood Institute, ON Semiconductor, One Brave Idea, SBXi, Start-Up Chile, U.S. Department of Health and Human Services",PARTICIPANT,
Micro-Leads — Grant (2025-06),"Boston University, Defense Advanced Research Projects Agency, GSK, MassVentures, National Institutes of Health, National Institutes of Neurological Disorders and Stroke, U. S. National Science Foundation, U.S. Department of Health and Human Services, United States Department of War",PARTICIPANT,
ReFocus Eye Health — Debt - Acquisition (2025-06),Zenyth Partners,PARTICIPANT,
Theromics — Grant (2025-06),"Beacon Angels, Maroon Venture Partners, Massachusetts Medical Device Development Center, MassVentures, Rines Angel Fund, Sorin, U. S. National Science Foundation",PARTICIPANT,
Kinotek — Later Stage VC (2025-06),"BRIDGE Angel Investors, Lake Nona Fund, LEAD (Venture Capital), Maine Technology Institute, Maine Venture Fund, Microsoft, Roux Institute at Northeastern University, Taher Savliwala, Tavistock Development Company",PARTICIPANT,
Ursamin — Later Stage VC (2025-06),"Fulcrum Ventures, INSPYRE, Nashville Entrepreneur Center, Springboard Enterprises",PARTICIPANT,
Sword Health — Later Stage VC (2025-06),"ADQ, Aging2.0, Armilar Venture Partners, Ativar Portugal, AWRC Wellbeing Accelerator, BOND Capital (San Francisco), BPEA Private Equity, Building Global Innovators, Capitalis Partners, Comcast Ventures, Earl Grey Capital, EQT Private Capital Asia, European Union, Faber Ventures, Founders Fund, General Catalyst, Global Health Accelerator, Green Innovations, Hakluyt Capital, Highmark Ventures, Horizon 2020, Iberis Capital, Incubadora de Empresas da UA, Indico Capital Partners, Instituto Pedro Nunes, Khosla Ventures, Lachy Groom, Lince Capital, Locapes Investment Fund, Oxy Capital, Partners Group, Phoenix Court, Sapphire Ventures, Shilling (Portugal), Sozo Ventures, Spearhead (VC), Transformation Capital, Vesalius Biocapital Partners, Willoughby Capital, Zurich Innovation Championship",PARTICIPANT,
Suno (Enterprise Systems) — Seed Round (2025-06),Fractal Software,PARTICIPANT,
Assured Allies — Later Stage VC (2025-06),"Akilia Partners, Core Innovation Capital, EquiTrust Life Insurance Company, FinTLV Ventures, GUTS, Hamilton Lane, Harel Insurance Investments & Financial Services, Kaedan Capital, LionBird, Lumir Ventures, MS&AD Ventures, Nathaniel Turner, New Era Capital Partners, Plug and Play Tech Center, Poalim Equity, Samsung NEXT Ventures, Wilton Re",PARTICIPANT,
Verse Medical — Later Stage VC (2025-06),"Abstract Ventures, Buckley Ventures, FundersClub, Hiddentao Ventures, Immad Akhund, JAM Fund, Joshua Buckley, Mantis VC, Pareto Holdings, Paul Graham, Sapphire Ventures, SignalFire, Soma Capital, Twenty Two Ventures, Wayfinder Ventures, Webb Investment Network, Y Combinator",PARTICIPANT,
Carez AI — Early Stage VC (2025-06),Entrepreneurs Roundtable Accelerator,PARTICIPANT,
Cristcot — Later Stage VC (2025-06),"Scientia Ventures, Shepherd Kaplan Krochuk, StartUp Health",PARTICIPANT,
Reprieve Cardiovascular — Later Stage VC (2025-06),"Abiomed, Arboretum Ventures, Cadence Capital, Deerfield Healthcare Technology Acquisitions, Deerfield Management, Exigent Capital Group, Genesis Capital, Lightstone Ventures, Rex Health Ventures, Santé Ventures, Santen Ventures",PARTICIPANT,
Clara (New York) — Seed Round (2025-06),"Torch Capital, Virtue (Austin), Y Combinator",PARTICIPANT,
MyLaurel — Later Stage VC (2025-06),"10X Capital, Acumen America, Acumen Fund, Ascend (Holding Companies), Beresford Ventures, City Light Capital, Cross Culture Ventures, Deerfield Management, Emerson Collective, Founders Fund, Frist Cressey Ventures, Growth Technology Partners, GV, JAM Fund, Justin Mateen, Kapor Capital, MaC Venture Capital, MANA Tech, Mill Town Capital, New Orleans BioInnovation Center, New Orleans Entrepreneur Week, Ochsner Health, Perigrove, Pinta Capital Partners, Propeller (US), Revolution (Washington DC), Summit Action, The Idea Village, Town Hall Ventures, Weekend Fund",PARTICIPANT,
Sama Fertility — Early Stage VC (2025-06),"Artesian, Brinc (Hong Kong), Homu Health Ventures, Rootspring Ventures",PARTICIPANT,
Neru Health — Seed Round (2025-05),"Allston Venture Fund, Better Ventures, Entrepreneurs Roundtable Accelerator, Harvard Innovation Launch Lab, Kli Capital, Remarkable Ventures, StartOut Growth Lab, StartX (US)",PARTICIPANT,
Brooklyn Health — Seed Round (2025-05),"Blue Falcon Capital, Everywhere Ventures, HealthX Ventures, Hypothesis Studio, KohFounders, Laconia Capital Group, Metrodora Ventures, RiverPark Ventures, Story Ventures",PARTICIPANT,
SimpliFed — Seed Round (2025-05),"3CC | Third Culture Capital, American Heart Association Ventures, CoLAB Accelerator, Cultivation Capital, Elizabeth Street Ventures, Empire State Development, Ignite Healthcare Network, Impact Assets, KID Venture Capital, Mass Digital Health, Morningside Group, New York Ventures, Rev: Ithaca Startup Works, Social Impact Partners, Springboard Enterprises, Tampa Bay Wave, The Artemis Fund, The Venture Collective, Waterline Ventures, WBL Fellows Program",PARTICIPANT,
Mitotherapeutix — Seed Round (2025-05),"Connecticut Innovations, National Institute of Diabetes and Digestive and Kidney Diseases, National Institutes of Health, U.S. Department of Health and Human Services, United States Department of Agriculture, University of Connecticut Technology Incubation Program",PARTICIPANT,
Local Infusion — Early Stage VC (2025-05),"blisce/, Brand Foundry Ventures, Meridian Street Capital, Nashville Entrepreneur Center, PharmStars, Transformation Capital",PARTICIPANT,
Centivo — Mezzanine (2025-05),"Alumni Ventures, B Capital Group, Bain Capital Ventures, Bessemer Venture Partners, Company Ventures, Cone Health, Cox Enterprises, Define Ventures, Eight Roads, F-Prime Capital, Global Public Offering Fund, HarbourVest Partners, Ingleside Investors, James Foreman, JP Morgan Chase, Kenneth Goulet, Kevin Hill, Maverick Ventures, MemorialCare Innovation Fund, Morgan Health, Oxeon Partners, Parkway Venture Capital, Socium Ventures, Trinity Capital (Phoenix), Valspring Capital",PARTICIPANT,
Courage Therapeutics — Seed Round (2025-05),"Arsenal Bridge Ventures, Innovation Partnerships, Michigan Biomedical Venture Fund, NASA SBIR/STTR, U.S. Department of Health and Human Services, What If Ventures",PARTICIPANT,
