deal_title,investor_company,investor_role,investment_amount_usd
SmartLabs — Later Stage VC (2024-01),"ArrowMark Partners, Breeds Hill Capital, Conversion Venture Capital, Falcon Investments, Winslow Capital Management",PARTICIPANT,
Kinetik Healthcare Solutions — Later Stage VC (2024-01),"AWS Startups, Ivy Ventures (Indianapolis), KidsX Accelerator, Valued Ventures",PARTICIPANT,
Doc.com — Later Stage VC (2024-01),Silver Rock Financial,PARTICIPANT,
Health In Her HUE — Later Stage VC (2024-01),"100KM Ventures, Bedua Partners, Female Founders - Grow F, Femovate, Genius Guild, Graham & Walker, GSB Impact Fund, GSK NEXT, HBCUvc, Healthworx, Healthworx Accelerator, Hockey Stick Investments, Impact Assets, Johnson & Johnson Services, Morgan Stanley Inclusive Ventures Lab, Nex Cubed, PharmStars, Pipeline Angels, Purple Sage Ventures, R/GA Ventures, Seae Ventures, Sidecut Ventures, The Founders Wing, Verizon Forward for Good, Village Capital, Vital Voices Global Partnership",PARTICIPANT,
Carda Health — Later Stage VC (2024-01),"Contour Venture Partners, Detroit Venture Partners, HDS Capital, NFX, Precursor Ventures, Primetime Partners, Rock Ventures, Siesta Ventures, Social Innovation Ventures, The MBA Fund, Velvet Sea Ventures",PARTICIPANT,
Cityblock — Later Stage VC (2024-01),"8VC, Citi Impact Fund, Citigroup Alternative Investments, Echo Health Ventures, Emblem Health, General Catalyst, Goldman Sachs Asset Management, Halle Tecco, Kinnevik, Lifeforce Capital, Mario Molina, Maverick Ventures, MicroVentures, Molini Besozzi Marzoli, Nathaniel Turner, Open Opportunity Fund, Oxeon Partners, Redpoint Ventures, SoftBank Investment Advisers, StartUp Health, Thrive Capital, Tiger Global Management, TMV(Trail Mix Ventures), Town Hall Ventures, Wellington Management, Wormhole Capital",PARTICIPANT,
Collaboratehealth — PE Growth/Expansion (2024-01),ITC Capital Partners,PARTICIPANT,
Crisis Text Line — Grant (2024-01),"Alison Pincus, Amy Stavis, Anne Devereux-Mills, Craig Newmark, Draper Richards Kaplan Foundation, Google for Startups, Greylock Energy, Joe Edelman, John S. and James L. Knight Foundation, Mark Pincus, Matthew Klein, Melinda Gates, Mission Daybreak, Omidyar Network, Reid Hoffman, Robert Stavis, Suzy Edelman, The Ballmer Group, The Hearst Foundations",PARTICIPANT,
First Tracks — Early Stage VC (2024-01),"Asymmetric Capital Partners, City Light Capital",PARTICIPANT,
EO — Seed Round (2023-12),"Imbolc Partners, MassChallenge",PARTICIPANT,
HealthDrive — Debt - General (2023-12),"Bain Capital Credit, Cressey & Company",PARTICIPANT,
knownwell — Early Stage VC (2023-12),"Andreessen Horowitz, Brynn Putnam, Flare Capital Partners, Flybridge (New York), Larry Summers, Lydia Gilbert, Oxeon Partners, Varsha Rao",PARTICIPANT,
Gastroenterology Associates (Williamsville) — PE Growth/Expansion (2023-12),PE Healthcare Associates,PARTICIPANT,
Medial Health — Early Stage VC (2023-12),"Draper Associates, Draper University, The Organization of Eastern Caribbean States",PARTICIPANT,
PRO Sports Physical Therapy of Westchester — Buyout/LBO (2023-12),Waud Capital Partners,PARTICIPANT,
Yorktown Center for Specialty Surgery — Later Stage VC (2023-12),Mount Sinai Ventures,PARTICIPANT,
Baroco — Buyout/LBO (2023-12),Pharos Capital Group,PARTICIPANT,
Monument — Later Stage VC (2023-12),"4D Capital, Alpaca VC, Calm Ventures, Collaborative Fund, Data Point Capital, Eastward Capital Partners, Forefront Venture Partners, Gaingels, H/L Ventures, Interplay Ventures, Kube VC, Lerer Hippeau, NextView Ventures, Red Sea Ventures, Rosecliff Venture Partners, Social Innovation Ventures, Tournon Ventures, VMG Partners, WndrCo",PARTICIPANT,
CME (United States) — Buyout/LBO (2023-12),SNH Capital Partners,PARTICIPANT,
Vincere Health — Merger/Acquisition (2023-11),"AWS Startups, Headwater Ventures",PARTICIPANT,
Windgap Medical — Later Stage VC (2023-11),"4.0 Partners, Allergy Partners, Bantam Group, Beta Fund, Boston Harbor Angels, Cherrystone Angel Group, Christine Fuchs, Cobro Ventures, Colle Capital Partners, David Blakelock, Foley Ventures, Harry Scott, InnoVentures Lab, Joe Caruso, Launchpad Venture Group, Maine Angels, MassChallenge, Michael Cain, National Institutes of Health, Richard Gill, Rupin Mohan, Scott Flamm, Shepherd Kaplan Krochuk, SideCar Angels, Silvio Estienne, Taiwania Capital, Wilmington Investor Network",PARTICIPANT,
Nonnatech — Later Stage VC (2023-11),"500 Global, 9Mile Labs, AARP Innovation Labs, AgeTech Collaborative, Flywheel Fund, gener8tor, New York City Economic Development, Quake Capital, Right Side Capital Management, StartUp Health, Various Nonnatech, Village Capital",PARTICIPANT,
Boston IVF — Buyout/LBO (2023-11),"Clínica Eugin, U.S. Department of Health and Human Services",PARTICIPANT,
Allied Physicians Group — Debt - Acquisition (2023-11),"Ascend Partners (Healthcare), CareAbout (Other Healthcare Services)",PARTICIPANT,
Kin Therapy — Seed Round (2023-11),Right Side Capital Management,PARTICIPANT,
Oui Therapeutics — Later Stage VC (2023-11),"Athyrium Capital Management, Bridge Builders Collaborative, CU Healthcare Innovation Fund, CVS Health Ventures, First Round Capital, Flare Capital Partners, Hopelab, Mission Daybreak, National Institutes of Health, Otsuka U.S., Polaris Partners",PARTICIPANT,
Sequel Med Tech — Early Stage VC (2023-11),"FemHealth Ventures, GG 1978",PARTICIPANT,
BioProcure — Buyout/LBO (2023-10),"PNC Erieview Capital, Primus Capital",PARTICIPANT,
Bond Vet — PE Growth/Expansion (2023-10),"Lukas Keindl, Paul Johnson, Talisman Capital Partners, Warburg Pincus",PARTICIPANT,
Rational Vaccines — Grant (2023-10),"10X Capital, AAF Management, Abstract Ventures, Flight Ventures, Founders Fund, Gaingels, Globivest, Ironbridge Capital, National Institutes of Health, Presight Capital, Smith Ventures, Social Impact Capital, Thiel Capital",PARTICIPANT,
InfoBionic.Ai — Later Stage VC (2023-10),"Beta Fund, Blue Cross and Blue Shield of Kansas, Blue Cross Blue Shield of Massachusetts, Boardwalk Pipeline Partners, Boynton Angels, Broadview Ventures, Cherrystone Angel Group, Eagle Investment Systems, Excel Venture Management, Fort Point Angels, HealthTech Capital, Hilltop Venture Partners, HTC, Ivan Gurrieri, Keiretsu Forum, Launchpad Venture Group, Mass Medical Angels, Mayo Clinic, Oleg Uritsky, Safeguard Scientifics, Sanjeev Jain, Security International Investments, SideCar Angels, Springboard Enterprises, TCA Venture Group, TiE Angels Boston, TiE Pune, Xandex Ventures, Zaffre Investments",PARTICIPANT,
Veristat — Debt - Acquisition (2023-10),"BPEA Private Equity, WindRose Health Investors",PARTICIPANT,
Panluminate — Early Stage VC (2023-09),"Connecticut Innovations, National Institute of Mental Health, New Haven Innovation Labs, SBXi",PARTICIPANT,
Hunterian — Seed Round (2023-09),"Cystic Fibrosis Foundation, Johns Hopkins Technology Ventures, National Institutes of Health",PARTICIPANT,
New York Genome Center — Grant (2023-09),"BD Breakthrough Discoveries for Thriving with Bipolar Disorder, Carson Family Charitable Trust, Heising-Simons Foundation, Partnership Fund for New York City, The National Human Genome Research Institute",PARTICIPANT,
Hallmark Health Care Solutions — PE Growth/Expansion (2023-09),"Ascension Ventures, Enhanced Healthcare Partners, Fidus Capital, Summit Partners",PARTICIPANT,
MICSI — Later Stage VC (2023-09),"Entrepreneurship Lab Bio & Health Tech NYC, Graphene Ventures, National Cancer Institute, National Institutes of Health, NVO Capital, NYU Entrepreneurial Institute, Orange Collective, Pioneer Fund, Y Combinator",PARTICIPANT,
Peer Collective — Early Stage VC (2023-09),"Crosscut Ventures, MedMountain Ventures",PARTICIPANT,
InsideTracker — Later Stage VC (2023-09),"BAMCAP, BASF Venture Capital, Cornucopian Capital, Doron Reuveni, Henry Kauftheil, MassVentures, Mount Independence Investments, OurCrowd, PeakBridge, Puget Sound Venture Club",PARTICIPANT,
Neurovascular Diagnostics — Grant (2023-09),"Brain Aneurysm Foundation, U. S. National Science Foundation, U.S. Department of Health and Human Services, UB Incubator, University at Buffalo",PARTICIPANT,
Orbita — Later Stage VC (2023-08),"AI Venture Labs, Cultivation Capital, Deloitte, HealthX Ventures, Manatt Phelps & Phillips, Manatt Ventures, MassChallenge, nvp capital, Philips Ventures, SAP.iO, The 4100 Group",PARTICIPANT,
Peace (Business/Productivity Software) — Early Stage VC (2023-08),"Chris Brooke, Francois Ammand, Hei Ming Cheng, Joachim Poylo, Pablo Fernandez, Patrick Berbon, Wei Cao",PARTICIPANT,
eddii — Seed Round (2023-08),"Alumni Ventures, Atento Capital, BakerBridge Capital, Kapor Capital, MedMountain Ventures, StartUp Health",PARTICIPANT,
PharmaSmart International — Debt - General (2023-08),CPS Capital (Toronto),PARTICIPANT,
Aspisafe — Later Stage VC (2023-08),"Kawn Ventures, Kayan Ventures, Octane (California), Wamda Capital",PARTICIPANT,
MeetCaregivers — Later Stage VC (2023-07),"37 Angels, EforAll, Expert DOJO, Golden Seeds, Kachuwa Impact Fund, Massachusetts Mutual Life Insurance, MassChallenge, MassMutual Impact Investing, TiE Angels Boston",PARTICIPANT,
FIGUR8 — Later Stage VC (2023-07),"Chloe Capital, Convergent Ventures (San Francisco), Creative Destruction Lab, Cue Ball, David Daglio, DigiTx Partners, E14 Fund, Evolution VC Partners, First Spark Ventures, GRIDS Capital, Jianming Yu, Joyance Partners, Massachusetts Institute of Technology, MIT Startup Exchange, Mo Bamba, P5 Health Ventures, Phoenix Venture Partners, Taiwan Global Angels, Taiwania Capital, United States Department of War, Verve Ventures (London)",PARTICIPANT,
Helpful (Healthcare Services) — Seed Round (2023-07),Redesign Health,PARTICIPANT,
Ageless Innovation — Later Stage VC (2023-07),AgeTech Collaborative,PARTICIPANT,
AmberGen — Grant (2023-06),"Bruker, MassVentures, U.S. Department of Health and Human Services, United States Department of War",PARTICIPANT,
breathing.ai — Later Stage VC (2023-06),"Expert DOJO, Gaingels, Jumpstart Foundry, Plug and Play Tech Center, Right Side Capital Management, Roux Institute at Northeastern University, Techstars, Unicorn Factory Lisboa, VentureOut (US)",PARTICIPANT,
Health Data Analytics Institute — Later Stage VC (2023-06),"Altered Capital, Harald McPike, The Invus Group",PARTICIPANT,
Author Health — Early Stage VC (2023-06),"Flare Capital Partners, General Atlantic",PARTICIPANT,
Cytosolix — Later Stage VC (2023-06),"Accelerator for Biosciences in Connecticut, Alix Ventures, Backed VC, BlueYard Capital, Connecticut Innovations, Creative Destruction Lab, Endless Frontier Labs, Yale University",PARTICIPANT,
Avo (Enterprise Systems (Healthcare)) — Later Stage VC (2023-06),"500 Global, 500 Startups LatAm, AlleyCorp, Columbia University Graduate School of Business, Columbia Venture Competition, Dunamu & Partners, Entrepreneurship Lab Bio & Health Tech NYC, Epsilon Health, FuturePlay, Kavita Patel, Las Olas Venture Capital, Mana Ventures, MedMountain Ventures, Mirae Asset Capital, Mount Sinai Innovation Partners, PennHealthX, Spring Camp, Startup Creasphere, StartUp Health, World Trade Ventures",PARTICIPANT,
WellSole — Seed Round (2023-06),"Jumpstart Foundry, Right Side Capital Management, University of Massachusetts Amherst Endowment",PARTICIPANT,
Medivis — Later Stage VC (2023-06),"Alumni Ventures, Arkitekt Ventures, Coalition Operators, Flight Ventures, Future Labs, Howard Riina, Hugo Barra, Initialized Capital, Kevin Durant, Koru Capital (New York), Mayo Clinic Ventures, Nordurver, NYU Summer Launchpad, Robert Iger, Robert Spetzler, Thirty Five Ventures, Thrive Capital, Vectr Ventures, Verizon Ventures",PARTICIPANT,
Hospital for Special Surgery Endowment — Grant (2023-06),"Arthritis Foundation, Flare Capital Partners, Stavros Niarchos Foundation, United States Department of War",PARTICIPANT,
Conduit Health — Seed Round (2023-06),"Eniac Ventures, Equitage Ventures, Twelve Below",PARTICIPANT,
Dr. B Public Benefit — Early Stage VC (2023-06),"Bloodhound Partners, Feld Ventures, Founders Fund, Humbition, LeFrak, Lerer Hippeau, Life Extension Ventures, MainSheet Ventures, Pareto Holdings, Phin Upham, Techni Ventures",PARTICIPANT,
UrgentIQ — Seed Round (2023-06),"Fractal Software, Sidekick Partners",PARTICIPANT,
ZiphyCare — Early Stage VC (2023-06),"Eugene Fooksman, LabQ founder, Network VC, One Planet Group, The Garage Syndicate, Verras Capital, WBL Fellows Program",PARTICIPANT,
Advanced Dental Brands — PE Growth/Expansion (2023-05),H.I.G. Capital,PARTICIPANT,
Batelle — Early Stage VC (2023-05),"Christian Angermayer, Edward Lando, Gaingels, Growth Box Ventures, Jeffrey Cruttenden, Jon Oringer, Material Ventures, Metaplanet Holdings, Nadav Ben, Pareto Holdings, re.Mind Capital, Taavet Hinrikus, Wheelhouse Digital Studios",PARTICIPANT,
OphyCare — Grant (2023-05),"CareOne (Elder and Disabled Care), Tech Alpharetta, Westchester County Biosciences Accelerator",PARTICIPANT,
The Dermatology Specialists — PE Growth/Expansion (2023-05),"GarMark Partners, Regal Healthcare Capital Partners",PARTICIPANT,
Uwill — Early Stage VC (2023-04),"Darryl McDaniels, Education Growth Partners, John Katzman, Stephen Kramer",PARTICIPANT,
1upHealth — Later Stage VC (2023-04),"Advisors.Fund, Boston Children's Hospital, Eniac Ventures, F-Prime Capital, Innovation & Digital Health Accelerator, Jackson Square Ventures, MassChallenge, Meridian Street Capital, Office of the National Coordinator for Health Information Technology, Scala Ventures, Sixth Street Partners, Social Leverage",PARTICIPANT,
Leda Health — Early Stage VC (2023-03),"2B.VC, ACME Capital, Alchemist Accelerator, Asymmetry Ventures, Blue Leaf Ventures, Calm/Storm Ventures, Fast Forward (California), Future Labs, G9 Ventures, Gaingels, Hornet Ventures, Houston Angel Network, Hypothesis Studio, Michelle Kennedy, Minal Hasan, Nashville Entrepreneur Center, New York Ventures, Ruca, Shaan Puri, Sterling Road, Stone Mountain Ventures (Texas), The Helm",PARTICIPANT,
Empassion — Early Stage VC (2023-03),"8VC, BAYADA Home Health Care, Oxeon Partners, Town Hall Ventures",PARTICIPANT,
InterWell Health — Later Stage VC (2023-03),"Fresenius Medical Care, G Ventures (VC), Oak HC/FT, Valtruis",PARTICIPANT,
TytoCare — Later Stage VC (2023-03),"Cambia Health Solutions, Clal Energy, Echo Health Ventures, Fosun Venture Capital Investment, Fuson Pharma, Healthcare of Ontario Pension Plan, Insight Partners (New York), Itochu, LionBird, MemorialCare Innovation Fund, MTIP, New Dimensions Health, OrbiMed, OTV, OurCrowd, Ping An Insurance (Group) Company of China, Ping An Voyager Partners, Qualcomm Ventures, Qumra Capital, Qure Ventures, Sanford Health, Shenzhen Capital Group, Teuza, Tiger Global Management, Walgreens Boots Alliance, Well Ventures",PARTICIPANT,
Bio Behavioral Institute — PE Growth/Expansion (2023-03),"Aspect Investors, Endurance Search Partners, Glass Lake Capital, Milk Street Ventures, Miramar Equity Partners, The Cambria Group, WSC & Company",PARTICIPANT,
Icon Health — Early Stage VC (2023-03),Montage Ventures,PARTICIPANT,
Epikast — Early Stage VC (2023-02),EcoR1 Capital,PARTICIPANT,
CardioFocus — Later Stage VC (2023-02),"Biobrit, BioMed Realty, First Alliance & Capital Invest, H.I.G. HealthBridge Partners, KBL Healthcare Ventures, Manatuck Hill Partners, Revelation Partners, Saints Capital, Schroders, SightLine Partners, SV Health Investors, The Aurora Funds, Western Technology Investment",PARTICIPANT,
ETAO International (PINX: ETAOF) — Reverse Merger (2023-02),Mountain Crest Acquisition III,PARTICIPANT,
Curie.Bio — Early Stage VC (2023-02),"5AM Ventures, AlleyCorp, Andreessen Horowitz, ARCH Venture Partners, Bessemer Venture Partners, BoxGroup, Casdin Capital, DNA Capital (Investor), F-Prime Capital, GV, KdT Ventures, Leaps by Bayer, Lightstone Ventures, Menlo Ventures, NFX, Northpond Ventures, Qiming Venture Partners, Shine Capital, Wormhole Capital",PARTICIPANT,
Mantra Health — Later Stage VC (2023-02),"14W, Alumni Ventures, Baleon Capital, Broad Creek Capital, Canaan Partners, City Light Capital, Elements Health Investors, Global Founders Capital, HOF Capital, New Markets Venture Partners, Nitin Nanda, VMG Partners, Western Technology Investment",PARTICIPANT,
Alloplex Biotherapeutics — Later Stage VC (2023-02),"Daewoong Pharmaceutical Company, Hanall Biopharma, Keiretsu Forum, Wells Investment",PARTICIPANT,
Wyndly — Early Stage VC (2023-02),"Cashmere Fund, Civilization Ventures, Goodwater Capital, Immeasurable, Kevin Mahaffey, Side Door Ventures, Underdog Labs, Y Combinator",PARTICIPANT,
FirstHand Health — Early Stage VC (2023-02),"GreyMatter (US), GV, Innate Capital Partners, Upsher Management Company, Watershed Collective",PARTICIPANT,
NY Ketamine Infusions — PE Growth/Expansion (2023-02),Council Capital,PARTICIPANT,
Stokes Counseling Services — Buyout/LBO (2023-02),"Eads Bridge Holdings, Parkway Capital",PARTICIPANT,
iVexSol — Later Stage VC (2023-01),"Asahi Kasei Corporate Venture Capital, Asahi Kasei Medical, Biolife Solutions, Bristol-Myers Squibb, Casdin Capital, Charles River Laboratories International, Massachusetts Biomedical Initiatives, Massachusetts Life Sciences Center",PARTICIPANT,
Pearl Health — Early Stage VC (2023-01),"10X Capital, AlleyCorp, Andreessen Horowitz, CoFound Partners, Floating Point, Gaingels, Kevin Ryan, SV Angel, Viking Global Investors",PARTICIPANT,
DocPanel — Later Stage VC (2023-01),CQuence Health Group,PARTICIPANT,
HearMe (Application Software) — Later Stage VC (2023-01),"Arsenal Capital Management, Ascent Capital, Chasing Rainbows, Flare Capital Partners, Gaingels, GHS Ventures, Plug and Play Tech Center",PARTICIPANT,
FreedomCare — PE Growth/Expansion (2023-01),Fidelity,PARTICIPANT,
Sky Therapeutics — Early Stage VC (2023-01),"E-UM Private Equity, IDrug, Jtango VC, Wamda Capital",PARTICIPANT,
BetterAge — Grant (2023-01),"Impact Assets, National Institute of Aging (NIA)",PARTICIPANT,
Cadence (Monitoring Equipment) — Early Stage VC (2023-01),"Adam Boehler, Coatue Management, Free Solo Ventures, General Catalyst, K5 Global, Martin Ventures, Metrodora Ventures, Roar Ventures, Thrive Capital",PARTICIPANT,
Circle Surrogacy and Egg Donation — Debt - Acquisition (2023-01),Cortec Group,PARTICIPANT,
Harley Street Medical — PE Growth/Expansion (2023-01),"Hunter Search Capital, Search Fund Partners",PARTICIPANT,
Measured Health — Early Stage VC (2023-01),"Initialized Capital, Michael Seibel, Open Opportunity Fund, Scott Galloway, Y Combinator",PARTICIPANT,
Pascall — Grant (2023-01),U.S. Department of Health and Human Services,PARTICIPANT,
Tandem (Healthcare Services) — Early Stage VC (2023-01),"Atria Ventures, Bain Capital Ventures, BoxGroup, Pear (California), Thrive Capital, Tournon Ventures, Vast Ventures, Zeal Talent Ventures",PARTICIPANT,
Connecticut Children's Medical Center — Grant (2022-12),"U.S. Department of Education, U.S. Department of Health and Human Services, U.S. Environmental Protection Agency, United States Department of War",PARTICIPANT,
Innerwell — Debt - General (2022-12),"Gershon Capital, Greenpoint Capital, Greycroft, Looking Glass Capital, Mana Ventures, Max Ventures, Riverside Ventures, Western Technology Investment",PARTICIPANT,
Telemynd — PE Growth/Expansion (2022-12),"Pleasant Bay Capital Partners, SB Investment Holdco",PARTICIPANT,
Cornerstone Treatment Facilities Network — Merger/Acquisition (2022-12),Oxer Capital,PARTICIPANT,
LEAF4Life — Early Stage VC (2022-12),"Gaingels, Infinitas Capital, Purpose Venture Capital",PARTICIPANT,
Universal Marine Medical Supply International — Buyout/LBO (2022-12),ZCG,PARTICIPANT,
Buoy Health — Later Stage VC (2022-12),"Beyond the Bounds Ventures, Cigna Ventures, Eight Roads, F-Prime Capital, Hambrecht Ducera Growth Ventures, Humana, Innovation & Digital Health Accelerator, Jack Connors, Keiretsu Forum, MassChallenge, MBX Capital, Optum Ventures, Sharon Knight, TiE SoCal Angels, Trustbridge Partners, W.R. Hambrecht + Co.",PARTICIPANT,
1AND1 — Later Stage VC (2022-11),Sequence Equity,PARTICIPANT,
The Lanby — Seed Round (2022-11),"2468 Ventures, Female Founders Fund, Goodwater Capital, LAUNCH Fund, Magic Fund, Myelin VC",PARTICIPANT,
DirectShifts — Later Stage VC (2022-11),"Alex Fair, AltaIR Capital, Anita Pramoda, Brian Holzer, Emles Venture Partners, Gaurav Mehta, Jacob Reider, Jim Sweeney, Mark Holmquist, MedStartr Venture Fund, Mehshah Capital, Neel Murthy, Peak State Ventures, Pioneer Fund, Scot Ward, Serent Capital, Soma Capital, UpHonest Capital, Venture Development Center (Massachusetts), VentureOut (US), Y Combinator, Ying Fund",PARTICIPANT,
Grouport — Early Stage VC (2022-11),"380 Cap, Goodwater Capital, Purpose Venture Capital, Stone Mountain Ventures (Texas), Taub Ventures, XV Venture Capital",PARTICIPANT,
Constant Therapy Health — Grant (2022-11),"Hearst Communications, Mass Innovation Network",PARTICIPANT,
Injured Workers Pharmacy — Secondary Transaction - Private (2022-11),"ACON Investments, Triton Pacific Capital Partners",PARTICIPANT,
RecoveryPlus.health — Later Stage VC (2022-11),"Blue Ocean Capital Group, Chongqing Pharscin Pharma, DYEE Capital, IDG Capital, Nanjing Fengzheng Yingtai",PARTICIPANT,
Akelos — Seed Round (2022-10),"National Institutes of Health, National Institutes of Neurological Disorders and Stroke",PARTICIPANT,
Accelera — Later Stage VC (2022-10),"Maine Technology Institute, Maine Venture Fund, The Wyss Foundation",PARTICIPANT,
Hippo (Healthcare Technology Systems) — Seed Round (2022-10),Ochsner Health,PARTICIPANT,
Helio Health (Clinics/Outpatient Services) — Grant (2022-10),"Federal Communications Commission, Federal Deposit Insurance, SAMHSA",PARTICIPANT,
Samaritan Daytop Village — Grant (2022-10),New York Community Trust,PARTICIPANT,
QualityMetric — Grant (2022-09),"Bratenahl Capital Partners, Optum",PARTICIPANT,
Ark Behavioral Health — PE Growth/Expansion (2022-09),"Healy Capital Partners, Hunter Street Partners",PARTICIPANT,
Joyuus — Grant (2022-09),U.S. Department of Health and Human Services,PARTICIPANT,
Affinity Dental Management — Debt Refinancing (2022-09),MidOcean Partners,PARTICIPANT,
Hopscotch (Healthcare Services) — Seed Round (2022-09),"Cold Start, eLab (New York), Entrepreneurs Roundtable Accelerator, Greycroft, Harvard Innovation Launch Lab, Inspired Capital (New York), New York Ventures, Remarkable Ventures, Watershed Collective",PARTICIPANT,
EpiVax — Grant (2022-09),"Avecia Biologics (Biodefense Vaccine), Breakthrough T1D, GBS|CIDP Foundation International, Impact Assets, Montel Williams Foundation, National Institute for Allergy and Infectious Disease, National Institute of Diabetes and Digestive and Kidney Diseases, National Institutes of Health, Slater Technology Fund, U.S. Food and Drug Administration",PARTICIPANT,
Resolve (Managed Care) — Later Stage VC (2022-09),"AlleyCorp, Endurance Companies, Gaingels, Indicator Ventures",PARTICIPANT,
Braver (Clinics/Outpatient Services) — Early Stage VC (2022-09),Maveron,PARTICIPANT,
COR Health — Secondary Transaction - Private (2022-09),Station Partners,PARTICIPANT,
Pager — Later Stage VC (2022-09),"Abundance Partners, Adam Goulburn, Carl Byers, Envision Healthcare, Fine Day Ventures, French Partners, Goodwater Capital, Grupo de Inversiones Suramericana, GuideWell, Haas Portman, Health Catalyst Capital Management, Horizon Blue Cross Blue Shield of New Jersey, Horizon Healthcare, Lux Capital, Michael Liou, Montage Ventures, New Enterprise Associates, Oxeon Partners, Peter McTeague, QueensBridge Venture Partners, Rani Aliahmad, Schechter Private Capital, Sound Ventures, Streamlined Ventures, Susquehanna Private Equity Investments, Three Fields Capital, Thyra Global Management, Todd Kimmel, Ullas Naik, Veronorte",PARTICIPANT,
Alma (Clinics/Outpatient Services) — Later Stage VC (2022-08),"Able Partners, BoxGroup, Cigna Ventures, First Round Capital, Hedosophia, Insight Partners (New York), Jordan Park Group, Kapor Capital, Nyca Partners, Oak HC/FT, Optum Ventures, Primary Venture Partners, Rainfall Ventures, Sound Ventures, Thoma Bravo, Tusk Venture Partners, UBS Group, Urban Innovation Fund",PARTICIPANT,
Regenacy Pharmaceuticals — Later Stage VC (2022-08),"3E Bioventures (China), Cobro Ventures, Rivas Capital, TA YA VENTURE HOLDINGS LIMITED, Taiwania Capital, Viva Biotech, Yonjin Venture",PARTICIPANT,
Adult & Pediatric Dermatology — Debt Refinancing (2022-08),Waud Capital Partners,PARTICIPANT,
Mamava — Seed Round (2022-08),"FreshTracks Capital, Solidarity of Unbridled Labour",PARTICIPANT,
PrescriberPoint — Seed Round (2022-08),"Adobe (Multimedia and Design Software), Adobe Ventures, Eli Lilly, MasterCard, Pfizer Ventures",PARTICIPANT,
Atria Health — PE Growth/Expansion (2022-08),Cypress Ridge Capital,PARTICIPANT,
Craniometrix — Seed Round (2022-08),"Cathexis Ventures, Defy Partners Management, J Ventures, Olive Tree Capital, Quiet Capital, Rebel Fund, SOCIETY FOR SCIENCE & THE PUBLIC, Y Combinator",PARTICIPANT,
New England Wellness Solutions — PE Growth/Expansion (2022-08),Shields Health Innovations,PARTICIPANT,
Boram — Early Stage VC (2022-08),"AJU IB Investment, Dunamu & Partners, Entrepreneur Ventures (Los Angeles), Interplay Ventures, LEAD (Venture Capital), Midnight Venture Partners, Strong Ventures",PARTICIPANT,
Groq Health — Early Stage VC (2022-08),Westway Capital,PARTICIPANT,
HeyJane — Early Stage VC (2022-08),"10X Capital, 37 Angels, Alumni Ventures, Amboy Street Ventures, Blue Trail Partners, Capital F, Dorm Room Fund, Feldsmith Capital, Flybridge (New York), Foursight Capital Partners, Freya Ventures, G9 Ventures, Gaingels, Jane Capital, Jesse Robbins, Joyance Partners, Juno Equity, Karman Ventures, Koa Labs, MPG Fund, Portfolia, Samothrace Partners, The Graduate Syndicate, The Helm, Ulu Ventures, Voyagers.io",PARTICIPANT,
